<?xml version="1.0"?>
<!DOCTYPE robot SYSTEM "robot.dtd">
<robot>
	<pdp canId="0" />
	<pigeon canId="50"
               rotation="0.0" />

       <!--
	<limelight tablename="limelight"
                  mountingheight="20.0"
                  horizontaloffset="-10.0"
                  mountingangle="15.0"
                  rotation="0.0"
                  targetheight="120.0"
                  targetheight2="30.0"
                  defaultledmode="currentpipeline"
                  defaultcammode="vision"
                  streammode="sidebyside"
                  snapshots="off"
                  crosshairx="0.5"
                  crosshairy="0.5"
                  secondcrosshairx="0.25"
                  secondcrosshairy="0.25" />

	<blinkin position = "front" 
		  pwmId = "0"/>
  -->

<!-- ====================================================
     Chassis
     ====================================================  -->
    <swervechassis   type="SWERVE"
                     wheelBase="14.0"  
                     track="14.0"
                     maxVelocity="194.4"
                     maxAngularVelocity="1591.2"
                     maxAcceleration="24.0"
                     maxAngularAcceleration="24.0">
			 
        <swervemodule type="RIGHT_BACK"
                      turn_p="0.5"
                      turn_i="0.1"
                      turn_d="0.0"
                      turn_f="0.0"
                      turn_nominal_val="0.0"
                      turn_peak_val="1.0"
                      turn_max_acc="20"
                      turn_cruise_vel="50"
                      wheelDiameter="4.0"
>
            <motor  usage="DRIVE"
                    canId="3"
                    pdpID="3"
                    type="FALCON"
                    inverted="true"
                    sensorInverted="false"
                    feedbackDevice="INTERNAL"
                    countsPerRev="2048"
                    gearRatio="6.86"
                    brakeMode="true"
                    follow="-1"
                    peakCurrentDuration="15.0"
                    continuousCurrentLimit="40.0"
                    peakCurrentLimit="50.0"
                    currentLimiting="true" 
                    forwardlimitswitch="false"
                    forwardlimitswitchopen="true"
                    reverselimitswitch="false"
                    reverselimitswitchopen="true"/>                  
             <motor  usage="TURN"
                    canId="2"
                    pdpID="2"
                    type="FALCON"
                    inverted="false"
                    sensorInverted="false"
                    feedbackDevice="INTERNAL"
                    countsPerRev="2048"
                    gearRatio="8.4"
                    brakeMode="true"
                    follow="-1"
                    peakCurrentDuration="15.0"
                    continuousCurrentLimit="40.0"
                    peakCurrentLimit="50.0"
                    currentLimiting="true" 
                    forwardlimitswitch="false"
                    forwardlimitswitchopen="true"
                    reverselimitswitch="false"
                    reverselimitswitchopen="true"/>        
		    <cancoder canId="2"
                            offset="-107.753906"/>
        </swervemodule>

        <swervemodule type="LEFT_BACK"
                      turn_p="0.5"
                      turn_i="0.1"
                      turn_d="0.0"
                      turn_f="0.0"
                      turn_nominal_val="0.0"
                      turn_peak_val="1.0"
                      turn_max_acc="10"
                      turn_cruise_vel="50"
			 wheelDiameter="4.0">
            <motor  usage="DRIVE"
                    canId="1"
                    pdpID="1"
                    type="FALCON"
                    inverted="false"
                    sensorInverted="false"
                    feedbackDevice="INTERNAL"
                    countsPerRev="2048"
                    gearRatio="6.86"
                    brakeMode="true"
                    follow="-1"
                    peakCurrentDuration="15.0"
                    continuousCurrentLimit="40.0"
                    peakCurrentLimit="50.0"
                    currentLimiting="true" 
                    forwardlimitswitch="false"
                    forwardlimitswitchopen="true"
                    reverselimitswitch="false"
                    reverselimitswitchopen="true"/>                  
             <motor usage="TURN"
                    canId="0"
                    pdpID="0"
                    type="FALCON"
                    inverted="false"
                    sensorInverted="false"
                    feedbackDevice="INTERNAL"
                    countsPerRev="2048"
                    gearRatio="8.4"
                    brakeMode="true"
                    follow="-1"
                    peakCurrentDuration="15.0"
                    continuousCurrentLimit="40.0"
                    peakCurrentLimit="50.0"
                    currentLimiting="true" 
                    forwardlimitswitch="false"
                    forwardlimitswitchopen="true"
                    reverselimitswitch="false"
                    reverselimitswitchopen="true"/>        
		    <cancoder canId="0"
                            offset="71.98242"/>
        </swervemodule>

        <swervemodule type="RIGHT_FRONT"
                      turn_p="0.5"
                      turn_i="0.1"
                      turn_d="0.0"
                      turn_f="0.0"
                      turn_nominal_val="0.0"
                      turn_peak_val="1.0"
                      turn_max_acc="10"
                      turn_cruise_vel="50"
			 wheelDiameter="4.0">
            <motor  usage="DRIVE"
                    canId="13"
                    pdpID="13"
                    type="FALCON"
                    inverted="true"
                    sensorInverted="false"
                    feedbackDevice="INTERNAL"
                    countsPerRev="2048"
                    gearRatio="6.86"
                    brakeMode="true"
                    follow="-1"
                    peakCurrentDuration="15.0"
                    continuousCurrentLimit="40.0"
                    peakCurrentLimit="50.0"
                    currentLimiting="true" 
                    forwardlimitswitch="false"
                    forwardlimitswitchopen="true"
                    reverselimitswitch="false"
                    reverselimitswitchopen="true"/>                  
             <motor  usage="TURN"
                    canId="12"
                    pdpID="12"
                    type="FALCON"
                    inverted="false"
                    sensorInverted="false"
                    feedbackDevice="INTERNAL"
                    countsPerRev="2048"
                    gearRatio="8.4"
                    brakeMode="true"
                    follow="-1"
                    peakCurrentDuration="15.0"
                    continuousCurrentLimit="40.0"
                    peakCurrentLimit="50.0"
                    currentLimiting="true" 
                    forwardlimitswitch="false"
                    forwardlimitswitchopen="true"
                    reverselimitswitch="false"
                    reverselimitswitchopen="true"/>        
		    <cancoder canId="12"
                            offset="66.35742"/>
        </swervemodule>

        <swervemodule type="LEFT_FRONT"
                      turn_p="0.5"
                      turn_i="0.1"
                      turn_d="0.0"
                      turn_f="0.0"
                      turn_nominal_val="0.0"
                      turn_peak_val="1.0"
                      turn_max_acc="10"
                      turn_cruise_vel="50"
			 wheelDiameter="4.0">
            <motor  usage="DRIVE"
                    canId="15"
                    pdpID="15"
                    type="FALCON"
                    inverted="false"
                    sensorInverted="false"
                    feedbackDevice="INTERNAL"
                    countsPerRev="2048"
                    gearRatio="6.86"
                    brakeMode="true"
                    follow="-1"
                    peakCurrentDuration="15.0"
                    continuousCurrentLimit="40.0"
                    peakCurrentLimit="50.0"
                    currentLimiting="true" 
                    forwardlimitswitch="false"
                    forwardlimitswitchopen="true"
                    reverselimitswitch="false"
                    reverselimitswitchopen="true"/>                  
             <motor usage="TURN"
                    canId="14"
                    pdpID="14"
                    type="FALCON"
                    inverted="false"
                    sensorInverted="false"
                    feedbackDevice="INTERNAL"
                    countsPerRev="2048"
                    gearRatio="8.4"
                    brakeMode="true"
                    follow="-1"
                    peakCurrentDuration="15.0"
                    continuousCurrentLimit="40.0"
                    peakCurrentLimit="50.0"
                    currentLimiting="true" 
                    forwardlimitswitch="false"
                    forwardlimitswitchopen="true"
                    reverselimitswitch="false"
                    reverselimitswitchopen="true"/>        
		    <cancoder canId="14"
                            offset="133.242188"/>
        </swervemodule>

    </swervechassis>  
 
<!-- ====================================================
     Mechanisms
     ==================================================== --> 
     <!--   
	<mechanism type="INTAKE">
		<motor usage="INTAKE1"
                     canId="10"
                     pdpID="10"
                     type="FALCON"
                     inverted="false"
                     sensorInverted="false"
                     feedbackDevice="INTERNAL"